{
  "complete": true,
  "create_only": true,
  "files": [
    {
      "bytes": 254812607,
      "relative_path": "smoke-1.pt",
      "sha256": "9b1e3c25a8b5503ec16b23c2768b53e0b1027710285daba65cb0912624ab3ea2",
      "written_order": 1
    },
    {
      "bytes": 254812607,
      "relative_path": "smoke-2.pt",
      "sha256": "f0b03989a52d5bc4c35a6e88b6bbd7a9716ee292a36e5d1da11405da9d941a71",
      "written_order": 2
    },
    {
      "bytes": 13691,
      "relative_path": "smoke_attempt.json",
      "sha256": "7d0bea40f48ed1fc9954a10ed86300d0e5517519fecebf21b10123099757c3ac",
      "written_order": 3
    }
  ],
  "image_digest": "sha256:403522b9a7a59b6db5d96fc211bdb3bdb80c6a9fcfa9d630541014c55587edc1",
  "manifest_written_last": true,
  "protocol_sha256": "e542841890322f2407553714c65ad153e4dfbdba3cb51dad61542e122a5a29a2",
  "schema_version": "jlens-s2-runtime-pack/v1",
  "source_commit": "06e1604cd8633ecdc3267eac19ff529b2e5d3f83",
  "stage": "S2-T0-smoke"
}
