{
  "complete": true,
  "create_only": true,
  "files": [
    {
      "bytes": 254812607,
      "relative_path": "smoke-1.pt",
      "sha256": "bc63c95ee830352a688f432ba4fffe2297b1fad027e520781212a65a5ce09138",
      "written_order": 1
    },
    {
      "bytes": 254812607,
      "relative_path": "smoke-2.pt",
      "sha256": "7554294191d32675fd78ba6bf3ec7a9692b1630e8e1eb0ea386b7b4c1c54ef9e",
      "written_order": 2
    },
    {
      "bytes": 13696,
      "relative_path": "smoke_attempt.json",
      "sha256": "bc8076c3f62a804073ad3323a00ef2fa42187962294ce3f0ff5e06ca75bf621c",
      "written_order": 3
    }
  ],
  "image_digest": "sha256:403522b9a7a59b6db5d96fc211bdb3bdb80c6a9fcfa9d630541014c55587edc1",
  "manifest_written_last": true,
  "protocol_sha256": "e542841890322f2407553714c65ad153e4dfbdba3cb51dad61542e122a5a29a2",
  "schema_version": "jlens-s2-runtime-pack/v1",
  "source_commit": "06e1604cd8633ecdc3267eac19ff529b2e5d3f83",
  "stage": "S2-T0-smoke"
}
