{
  "complete": true,
  "create_only": true,
  "files": [
    {
      "bytes": 121097,
      "relative_path": "selected_configuration.json",
      "sha256": "44720471570b63bff6eda6f8c4df56c5703adf5c22803d4968eb1a401df02440",
      "written_order": 1
    }
  ],
  "image_digest": "sha256:403522b9a7a59b6db5d96fc211bdb3bdb80c6a9fcfa9d630541014c55587edc1",
  "manifest_written_last": true,
  "protocol_sha256": "e542841890322f2407553714c65ad153e4dfbdba3cb51dad61542e122a5a29a2",
  "schema_version": "jlens-s2-runtime-pack/v1",
  "source_commit": "06e1604cd8633ecdc3267eac19ff529b2e5d3f83",
  "stage": "S2-T0-selection"
}
